picture,description,calories,balance,quality,datetime
,Bread without gluten and mermelade and coffee,128,Unbalance,Low quality,NA
,Croûte au fromage,1186,Unbalance,Good quality,NA
,Bread without gluten and mermelade and coffee,128,Unbalance,Low quality,NA
,Chicken with lettuce and pasta and an apple,674,Unbalance,Good quality,NA
,"Lettuce with tomato, turkey ham, boiled egg, bread and an apple",376,Balance,Medium quality,NA
,Bread without gluten and mermelade and coffee,128,Unbalance,Low quality,NA
,Beef meat with potatoes and green beans,309,Unbalance,Good quality,NA
,"Lettuce with tomato salad, dried meat, bread and grapes ",315,Unbalance,Good quality,NA
,"spaetzli with brussels sprouts, beef,chestnuts and mousse of chestnuts with cake",615,Unbalance,Medium quality,NA
